,artist,dateposted,description,itemid,itunes_link,loved_count,p_id,posted_count,postid,posturl,pub_audio_unavail,siteid,sitename,thumb_url,thumb_url_large,thumb_url_medium,time,title,ts_loved_me
555,Panda Bear,1414672964,"Noah Lennox, or Panda Bear, is finally back, four years after the release of his Person Pitch follow-up, Tomboy. Compared to Person Pitch, Tomboy...",27dzs,http://hypem.com/go/itunes_search/Panda%20Bear,97,,3,2558214,http://survivingthegoldenage.com/panda-bear-mr-noah/,,1056,surviving the golden age,http://static.hypem.net/solid_color/thumbs_new/6/2558214.jpg,http://static.hypem.net/thumbs_new/6/2558214_640.jpg,https://static.hypem.com/solid_color/items_images/f9/27dzs_120.jpg,253,Mr Noah,1415400442
556,RiFF RAFF,1415197708,I’ll be 100% honest with you: until last week I was the last person on Earth who would be postin’ to TMT about Riff Raff. I had ZERO interest in the rapper who James Franco may or may not have based his appearance in “Spring Breakers” on; but thanks to Ju,24pvr,http://hypem.com/go/itunes_search/RiFF%20RAFF,1114,,5,2561870,http://www.tinymixtapes.com/chocolate-grinder/listen-riff-raff-kokayne,,5894,Tiny Mix Tapes,http://static.hypem.net/solid_color/thumbs_new/4e/2561870.jpg,https://static.hypem.com/items_images/78/24pvr_640.jpg,https://static.hypem.com/solid_color/items_images/78/24pvr_120.jpg,183,KOKAYNE (PROD. BY DiPLO),1415400317
557,Yelle,1400512047,"EMPT loves Yelle. “Chimie Physique” is one of Yelle’s most popular tracks and rightfully so. Yelle’s upfront vocals always do two things: they make people dance, and they make everyone want to learn French. This super sexy Gold Fields remix takes the esse",1na76,http://hypem.com/go/itunes_search/Yelle,700,,7,2464055,http://www.etmusiquepourtous.com/2014/05/19/yelle-chimie-physique-gold-fields-remix/,,10096,Et Musique Pour Tous,http://static.hypem.net/solid_color/thumbs_new/37/2464055.jpg,https://static.hypem.com/items_images/e6/1na76_640.jpg,https://static.hypem.com/solid_color/items_images/e6/1na76_120.jpg,416,Chimie Physique (Gold Fields remix,1400791300
558,Major Lazer,1398634572,"Here is the one and only Illegal Sunday, just as you knew it from AudioPorn Central. ENJOY IT AND SPREAD THE WORLD! Share, like, tweet, reblog, you know what to do. Get and give, you know ;) Do you wanna see your edit, remix, mashup featured next time? SU",244ay,http://hypem.com/go/itunes_search/Major%20Lazer,35,,1,2452187,http://moarrr.com/post/84052673660,True,4779,MOARRR,http://static.hypem.net/solid_color/thumbs_new/db/2452187.jpg,https://static.hypem.com/items_images/5e/244ay_500.jpg,https://static.hypem.com/solid_color/items_images/5e/244ay_120.jpg,123,Bubble Butt (Scattle Bootleg),1399097121
559,Mac Miller,1369751323,"I love these atypical collaborations between musicians. Mac Miller, the Pittsburgh MC who always keeps his sound diverse by working with a plethora of artists, joins forces with Diplo, a man who definitely needs no introduction and is arguably one of the ",1wx2c,http://hypem.com/go/itunes_search/Mac%20Miller,223,,1,2194335,http://www.earmilk.com/2013/05/28/mac-miller-goosebumpz-prod-by-diplo/,,11067,EARMILK,https://static.hypem.com/solid_color/83c441,https://static.hypem.com/items_images/4c/1wx2c_640.jpg,https://static.hypem.com/solid_color/items_images/4c/1wx2c_120.jpg,202,Goosebumpz,1369766678
560,Macklemore & Ryan Lewis vs Major Lazer,1369431827,Everyones favorite feature rapper 2 Chainz hopped on Major Lazers smash single Bubble Butt which is available now on iTunes here: http://smarturl.it/BubbleButtRemix Major Lazer also just dropped their MACKLEMORE & RYAN LEWIS vs MAJOR LAZER – can’t hold us,1wt29,http://hypem.com/go/itunes_search/Macklemore%20&%20Ryan%20Lewis%20vs%20Major%20Lazer,4624,,16,2192114,http://www.maddecent.com/blog/major-lazer-bubble-butt-feat-2-chainz-bruno-mars-tyga-mystic-out-now/,,4783,Maddecent,http://static.hypem.net/solid_color/thumbs_new/f2/2192114.jpg,http://static.hypem.net/thumbs_new/f9/2192633_640.jpg,https://static.hypem.com/solid_color/items_images/49/1wt29_120.jpg,233,Can't Hold Us Remix (feat. Swappi & 1st klase),1369688093
561,Beck,1368478352,Five versions of the traditional song 'Stagolee' and its variants.,1wj5j,http://hypem.com/go/itunes_search/Beck,25,,1,2179860,http://www.covermesongs.com/2013/05/five-good-covers-stagolee-traditional.html,True,5149,Cover Me,http://static.hypem.net/solid_color/thumbs_new/14/2179860.jpg,https://static.hypem.com/items_images/b2/1wj5j_640.jpg,https://static.hypem.com/solid_color/items_images/b2/1wj5j_120.jpg,167,Stagolee,1368488650
562,Beyoncé feat. André 3000,1367854588,The most looked forward to track from the Great Gatsby soundtrack has finally leaked. It is Beyonce and Andre 3000‘s cover of Amy Winehouse‘s “Back To Black.” Andre 3000 does... read more at survivingthegoldenage.com,1wcce,http://hypem.com/go/itunes_search/Beyoncé%20feat.%20André%203000,6330,,5,2172414,http://survivingthegoldenage.com/beyonce-andre-3000-back-to-black/,,1056,surviving the golden age,http://static.hypem.net/solid_color/thumbs_new/fe/2172414.jpg,https://static.hypem.com/items_images/8e/1wcce_640.jpg,https://static.hypem.com/solid_color/items_images/8e/1wcce_120.jpg,203,Back To Black,1367868965
563,Feist,1374610149,"It’s time once again for the best kept secrete on the summer festival docket. Newport is the Liz Lemon of festivals, industrious, organized and over-looked as an asset. With ticket...",1gj9q,http://hypem.com/go/itunes_search/Feist,4707,,29,2249691,http://survivingthegoldenage.com/tuesday-top-10-newport-folk-festival-13/,,1056,surviving the golden age,http://static.hypem.net/solid_color/thumbs_new/db/2249691.jpg,https://static.hypem.com/items_images/37/1gj9q_640.jpg,https://static.hypem.com/solid_color/items_images/37/1gj9q_120.jpg,190,How Come You Never Go There (Beck Remix),1367851052
564,Al Bankole,1367244703,"London producer, Al Bankolé just dropped his new track, “Feel.” The track sounds like something you might hear bumping in a Abercrombie store. It has a classic house drum track... read more at survivingthegoldenage.com",1w73n,http://hypem.com/go/itunes_search/Al%20Bankole,2,,2,2165308,http://survivingthegoldenage.com/al-bankole-feel/,,1056,surviving the golden age,http://static.hypem.net/solid_color/thumbs_new/3c/2165308.jpg,https://static.hypem.com/images/albumart/320/4.png,https://static.hypem.com/solid_color/items_images/75/1w73n_120.jpg,444,Feel (unmastered),1367260126
565,Serge Gainsbourg,1367248098,"Estaba leyendo Evguénie Sokolov de Serge Gainsbourg, y en la introducción de la versión americana publicada en 1998, Bart Plantenga menciona el tema escrito por Bob Dylan The Ballad of Hollis Brown. Eso me llevo a dos covers que en partícular me gustan mu",1w752,http://hypem.com/go/itunes_search/Serge%20Gainsbourg,16,,1,2165395,http://8106.tv/blog/2013/04/29/man-created-god-the-inverse-remains-to-be-proven/,True,3841,8106,http://static.hypem.net/solid_color/thumbs_new/93/2165395.jpg,https://static.hypem.com/items_images/a2/1w752_640.jpg,https://static.hypem.com/solid_color/items_images/a2/1w752_120.jpg,172,Evguenie Sokolov,1367259760
566,Phoenix,1366894865,Did you ever wonder what it would sound like if Phoenix weren’t an arena-sized dance pop act and instead were a highly syncopated indie band? Now is your chance to... read more at survivingthegoldenage.com,1w45v,http://hypem.com/go/itunes_search/Phoenix,369,,16,2161840,http://survivingthegoldenage.com/phoenix-entertainment-dirty-projectors-remix/,,1056,surviving the golden age,http://static.hypem.net/solid_color/thumbs_new/b0/2161840.jpg,https://static.hypem.com/items_images/bb/1w45v_640.jpg,https://static.hypem.com/solid_color/items_images/bb/1w45v_120.jpg,200,Entertainment (Dirty Projectors Remix),1366901976
567,Chumbawamba,1366208081,"Con integrantes de LA SERENA MORENA, y TROPICAL FOREVER, esta agrupacion ha dado saltos grandes durante los últimos meses como LOS ASTROS DE MENDOZA, quienes despues de su 1er Vive Latino, dejaron muy buena impresión con su covers cumbieros en vivo, que c",1vy2z,http://hypem.com/go/itunes_search/Chumbawamba,13,,1,2153047,http://www.bootlegumachine.com/2013/04/astros-de-mendoza-tubthumping.html,,11073,Bootlegumachine,http://static.hypem.net/solid_color/thumbs_new/57/2153047.jpg,https://static.hypem.com/items_images/5f/1vy2z_640.jpg,https://static.hypem.com/solid_color/items_images/5f/1vy2z_120.jpg,206,03 Tubthumping (Astros de mend,1366213420
568,Gorillaz,1366585453,Stream and download after the jump http://www.mediafire.com/?ice5d37abwl33is,1vv3j,http://hypem.com/go/itunes_search/Gorillaz,3762,,4,2157293,http://www.nerdyframes.org/?p=41536,,16288,Nerdy Frames,http://static.hypem.net/solid_color/thumbs_new/ed/2157293.jpg,https://static.hypem.com/items_images/72/1vv3j_640.jpg,https://static.hypem.com/solid_color/items_images/72/1vv3j_120.jpg,354,Dare (Noize Generation Remix),1366053255
569,Robby Hunter Band,1365970472,"I can’t tell you how much I love a productive Sunday. Waking up early, getting a good run in, sitting for a while on a random bench in the park just staring at the sky, then eating fruits and yogurt for breakfast. It’s all a part of what I’m calling my ne",1v5zn,http://hypem.com/go/itunes_search/Robby%20Hunter%20Band,2771,,13,2149637,http://www.etmusiquepourtous.com/2013/04/14/robby-hunter-band-hard-on-me/,,10096,Et Musique Pour Tous,http://static.hypem.net/solid_color/thumbs_new/5/2149637.jpg,http://static.hypem.net/thumbs_new/6c/2120300_640.jpg,https://static.hypem.com/solid_color/items_images/f5/1v5zn_120.jpg,172,Hard on Me,1366053022
570,Drazy Hoops,1366027090,"It’s strange to find an album, that isn’t a pop album, with 10 songs under three and a half minutes. Only four songs on the new 14-track album from New York City’s Drazy Hoops surpass the four-minute mark. This Is the Sound of… is the eighth LP from Hoops",1vvyv,http://hypem.com/go/itunes_search/Drazy%20Hoops,2,,1,2150100,http://survivingthegoldenage.com/drazy-hoops-this-is-the-sound-of/,,1056,surviving the golden age,http://static.hypem.net/solid_color/thumbs_new/d4/2150100.jpg,https://static.hypem.com/images/albumart/320/3.png,http://static.hypem.net/solid_color/thumbs_new/d4/2150100_120.jpg,142,I Ain't Never Pressed to Bother,1366052920
571,Gnucci,1366029766,"We here at Discobelle are proud to present a big and exclusive release for you today. Since releasing her debut EP “Oh My Goodness!” last year, Gnucci has dropped the Banana in her name but still maintains her unique take on club music and the tropical ba",1vw1a,http://hypem.com/go/itunes_search/Gnucci,51,,5,2150153,http://www.discobelle.net/2013/04/15/gnucci-ft-jasmine-solano-zuzuka-poderosa-lady-chann-nadia-nair-goodah-remix/,,1009,Discobelle,http://static.hypem.net/solid_color/thumbs_new/9/2150153.jpg,https://static.hypem.com/items_images/2a/1vw1a_640.jpg,https://static.hypem.com/solid_color/items_images/2a/1vw1a_120.jpg,318,"Goodah (Remix feat. Jasmine Solano, Zuzuka Poderosa, Lady Chann & Nadia Nair)",1366052466
572,Lorde,1373997874,"Dead Horse March presents the premiere mixtape, brought to you by the fine folks at FBDC. Give this ear-candy a swallow and let us know how it treats you… “Let this mix do nothing for you or everything for you. That’s what it’s here for. We luh dis muzik.",1sk06,http://hypem.com/go/itunes_search/Lorde,7801,,22,2242725,http://www.deadhorsemarch.com/dhm-8tracks/,,17117,Dead Horse March,http://static.hypem.net/solid_color/thumbs_new/a5/2242725.jpg,https://static.hypem.com/items_images/6/1sk06_640.jpg,https://static.hypem.com/solid_color/items_images/6/1sk06_120.jpg,202,The Love Club,1366038326
573,Jim Jones feat. Chink Santana,1365464973,Cherish your solitude. Take trains by yourself to places you have never been. Sleep out alone under the stars. Learn how to drive a stick shift. Go so far away that you stop being afraid of not coming back. Say no when you don’t want to do something. Say ,1vq7j,http://hypem.com/go/itunes_search/Jim%20Jones%20feat.%20Chink%20Santana,56,,1,2143325,http://www.etmusiquepourtous.com/2013/04/08/jim-jones-perfect-day/,,10096,Et Musique Pour Tous,http://static.hypem.net/solid_color/thumbs_new/5d/2143325.jpg,https://static.hypem.com/items_images/f2/1vq7j_500.jpg,https://static.hypem.com/solid_color/items_images/f2/1vq7j_120.jpg,194,Perfect Day,1365626833
574,Marcel Woods vs. Yeah Yeah Yeahs & A-Trak,1365543733,"Ear-deafening phrases, classic reverb boosters and rumbling tune selection could only mean one thing. “Sir” Henry Fong is in town Ladies and Gents. Epically driven, as Lewis Hamilton would be around the Marina Bay Street Circuit, Henry Fong sets corners a",1vr35,http://hypem.com/go/itunes_search/Marcel%20Woods%20vs.%20Yeah%20Yeah%20Yeahs%20&%20A-Trak,35,,1,2144794,http://www.aerialnoise.com/2013/04/09/henry-fongs-stereo-charged-soundsystem/,True,12376,aerial noise,http://static.hypem.net/solid_color/thumbs_new/1a/2144794.jpg,http://static.hypem.net/thumbs_new/1a/2144794_320.jpg,http://static.hypem.net/solid_color/thumbs_new/1a/2144794_120.jpg,199,Guaba Will Roll (Henry Fong Mashup),1365622752
575,Snoop Lion,1438698919,"In a tragic conclusion to an eventful weekend, a male and female attendee at Drake's OVO Festival afterparty were killed in a ""sporadic"" shooting, while three other victims were transported to the hospital in critical condition. The shooting occurred at 3",1v91m,http://hypem.com/go/itunes_search/Snoop%20Lion,4381,,20,2733083,http://inyourspeakers.com/content/news/292-two-killed-three-critical-condition-after-shooting-drake-hosted-ovo-fest-afterparty,True,13291,Inyourspeakers Media,http://static.hypem.net/solid_color/thumbs_new/1b/2733083.jpg,https://static.hypem.com/items_images/34/1v91m_640.jpg,https://static.hypem.com/solid_color/items_images/34/1v91m_120.jpg,212,No Guns Allowed (feat. Drake & Cori B.),1365266924
576,,1364584517,"France has long been recognized as a mecca for electronic music. From uber-commercial acts like David Guetta, to indie darlings (albiet turned uber-commercial) Daft Punk, the French electronic scene, and specifically the house scene, has permeated all fac",1vgbm,http://hypem.com/go/itunes_search/,28,,1,2133636,http://www.etmusiquepourtous.com/2013/03/29/empt-presents-indaba-music-weekly-inspir-better-together/,,10096,Et Musique Pour Tous,http://static.hypem.net/solid_color/thumbs_new/84/2133636.jpg,https://static.hypem.com/images/albumart/320/2.png,http://static.hypem.net/solid_color/thumbs_new/84/2133636_120.jpg,228,Inspir-Inspir - Better Together-2026222,1364839812
577,(Snippet) Laurent Garnier,1380315702,"Next Thursday, October 3rd the Bromance crew is back in NYC at the newly named Slake and we have 2 tickets to give to one of you! All you gotta do is shoot a tweet at @gottadancedirty @slakenyc and @bromancerecords with you’re favorite Bromance track to e",1rwk1,http://hypem.com/go/itunes_search/(Snippet)%20Laurent%20Garnier,170,,5,2315975,http://www.gottadancedirty.com/2013/09/27/events-win-2-tickets-to-bromance-records-at-slake-nyc/,True,10215,gottadancedirty,http://static.hypem.net/solid_color/thumbs_new/c7/2315975.jpg,http://static.hypem.net/thumbs_new/c7/2315975_640.jpg,http://static.hypem.net/solid_color/thumbs_new/c7/2315975_120.jpg,148,Jacques in The Box (Brodinski & Gesaffelstein 420 Rmx),1364838587
578,Vitalic,1364831389,"Vitalic will be releasing his Fade Away – Remixes EP digitally on the March 25th. Off the EP comes the highly anticipated remix from French turntable legends, C2C. As expected the remix contains some great vocal stuttering and boom-bap drums. read more at",1v73a,http://hypem.com/go/itunes_search/Vitalic,3879,,18,2135261,http://survivingthegoldenage.com/vitalic-fade-away-c2c-remix/,,1056,surviving the golden age,http://static.hypem.net/solid_color/thumbs_new/dd/2135261.jpg,https://static.hypem.com/items_images/6a/1v73a_640.jpg,https://static.hypem.com/solid_color/items_images/6a/1v73a_120.jpg,315,Fade Away (C2C Remix),1364838379
579,La Femme,1507793327,La Femme Album: Hypsoline – EP (Buy) Label: Disque Pointu La Femme – It’s Time to Wake Up (2023) Tweet,1vffh,http://hypem.com/go/itunes_search/La%20Femme,160,,2,3237365,http://www.rollogrady.com/la-femme-its-time-to-wake-up-2023/,,6356,Rollo & Grady,http://static.hypem.net/solid_color/thumbs_new/86/2132358.jpg,https://static.hypem.com/items_images/f1/1vffh_640.jpg,https://static.hypem.com/solid_color/items_images/f1/1vffh_120.jpg,412,It's Time to Wake Up (2023),1364569937
580,Generationals,1365075779,"Spring is here; the weather is getting warmer, the days are getting longer, and everything sure does seem a lot happier. Around this time of the year we all begin to feel a bit more cheery, and look towards upbeat music to help break us into the new seaso",1tw22,http://hypem.com/go/itunes_search/Generationals,13380,,38,2139018,http://survivingthegoldenage.com/generationals-heza/,,1056,surviving the golden age,http://static.hypem.net/solid_color/thumbs_new/8a/2139018.jpg,https://static.hypem.com/items_images/42/1tw22_640.jpg,https://static.hypem.com/solid_color/items_images/42/1tw22_120.jpg,226,Put a Light On,1364567644
581,The Hood Internet,1364857488,"These are the mashes that are worth hearing, so stop your searching and instead settle down at your computer... turn up your speakers... and get ready for that sweet nectar that only EARMILK can give ya. Let's GO! So it's April Fool's, and if you haven't ",1vf1z,http://hypem.com/go/itunes_search/The%20Hood%20Internet,282,,2,2135811,http://www.earmilk.com/2013/04/01/mashup-monday-week-85/,True,11067,EARMILK,http://static.hypem.net/solid_color/thumbs_new/3/2135811.jpg,https://static.hypem.com/images/albumart/320/1.png,http://static.hypem.net/solid_color/thumbs_new/3/2135811_120.jpg,197,Default Lane (Nicki Minaj vs Atoms For Peace),1364486509
582,Vacationer,1398316489,"Last Thursday, Sasha and I went to see Vacationer and Heavenly Beat at Lee’s Palace. I said hi to John Peña, the ex-bassist from Beach Fossils and total dreamboat behind Heavenly Beat. I was able to snag a pressing of Prominence (October 2013 on Captured ",1jyfy,http://hypem.com/go/itunes_search/Vacationer,763,,6,2450444,http://musicbetweenfriends.com/2014/04/24/heavenly-beat-and-vacationer/,,13848,MUSIC BETWEEN FRIENDS,http://static.hypem.net/solid_color/thumbs_new/c/2450444.jpg,https://static.hypem.com/items_images/fe/1jyfy_640.jpg,https://static.hypem.com/solid_color/items_images/fe/1jyfy_120.jpg,198,Everyone Knows,1364226818
583,Chrome Sparks,1334162341,"Chrome Sparks promo photo Press releases have this reputation for being wordy, impenetrable and usually vastly overblown. Chrome Sparks and his team are evidently on a mission to put that right: when I contacted them for more information, I received a who",1d0xt,http://hypem.com/go/itunes_search/Chrome%20Sparks,645,,10,1775887,http://www.listenbeforeyoubuy.net/introducing-2/introducing-chrome-sparks/,,13413,Listen Before You Buy,http://static.hypem.net/solid_color/thumbs_new/d9/1666009.jpg,https://static.hypem.com/items_images/ba/1d0xt_500.jpg,https://static.hypem.com/solid_color/items_images/ba/1d0xt_120.jpg,303,"Doubt, No",1364226810
584,Andy Bull,1375814545,"A week or so ago, a dear friend of mine asked me how we know that we are making the best decisions for ourselves when we make them. My response to her was more philosophical than anything else, but it went like this: ‘We never really know, we just have to",1v1ec,http://hypem.com/go/itunes_search/Andy%20Bull,5845,,15,2263459,http://www.etmusiquepourtous.com/2013/08/06/andy-bull-keep-on-running/,,10096,Et Musique Pour Tous,http://static.hypem.net/solid_color/thumbs_new/a3/2263459.jpg,https://static.hypem.com/items_images/cc/1v1ec_640.jpg,https://static.hypem.com/solid_color/items_images/cc/1v1ec_120.jpg,225,Keep On Running,1364171824
585,MF Doom,1368472568,"This brings me back to my teen years, scary how time flys by so quickly and yet we are still listening to the same tunes and trying to find ways to give them a little modern flavor without destroying the magic taste that it already possesses. “The Mouse a",1vbpz,http://hypem.com/go/itunes_search/MF%20Doom,4088,,6,2179727,http://www.etmusiquepourtous.com/2013/05/13/danger-doom-benzie-box-opiuo-rework/,True,10096,Et Musique Pour Tous,http://static.hypem.net/solid_color/thumbs_new/8f/2179727.jpg,http://static.hypem.net/thumbs_new/8f/2179727_320.jpg,http://static.hypem.net/solid_color/thumbs_new/8f/2179727_120.jpg,198,Benzie Box (Opiuo Rework),1364158799
586,Big Black Delta,1364437004,"Big Black Delta is Johnathan Bates, a former member of LA outfit Mellowdrone who has found a new home in the Chicago suburbs with a new sound to match. After bouncing between musical odd jobs including a stint touring with M83, Bates has constructed an ep",1v7cc,http://hypem.com/go/itunes_search/Big%20Black%20Delta,70,,2,2131600,http://anotherdyingartform.com/post/46464672034/big-black-delta-big-black-delta-our-april-30,True,15688,Another Dying Art Form,http://static.hypem.net/solid_color/thumbs_new/90/2131600.jpg,http://static.hypem.net/thumbs_new/90/2131600_320.jpg,http://static.hypem.net/solid_color/thumbs_new/90/2131600_120.jpg,266,huggin' and kissi,1364158345
587,Rihanna,1361494609,"This week we’re going to switch it up and just post a bunch of new tunes I came across via email and while browsing the web. Also, the picture above is Lil Wayne next to Fat Joe, when Lil Wayne use to not dress the way he does now, and when Fat Joe was ac",1tn54,http://hypem.com/go/itunes_search/Rihanna,28396,,21,2094794,http://www.maddecent.com/blog/trapd-thursday-4/,,4783,Maddecent,http://static.hypem.net/solid_color/thumbs_new/ca/2094794.jpg,https://static.hypem.com/items_images/a4/1tn54_640.jpg,https://static.hypem.com/solid_color/items_images/a4/1tn54_120.jpg,215,Stay (Branchez Bootleg),1364088702
588,Wavves,1366164887,I am still not sure how I feel about the new album for Nathan Williams and his collaborators. I have no problem going for the gold and dropping the whole fuzz-first aesthetic. That was always Wavves’ calling card and now they sound like everyone else. If ,1rw8m,http://hypem.com/go/itunes_search/Wavves,756,,34,2152530,http://anotherdyingartform.com/post/48162904397/wavves-afraid-of-heights-out-now,,15688,Another Dying Art Form,http://static.hypem.net/solid_color/thumbs_new/52/2152530.jpg,https://static.hypem.com/items_images/14/1rw8m_640.jpg,https://static.hypem.com/solid_color/items_images/14/1rw8m_120.jpg,195,Sail To The Sun,1363874244
589,Schoolboy Q,1355766117,25 Sleigh Bells – Reign of Terror Comeback Kid – Sleigh Bells Sometimes I have these weird dreams where Alexis Kraus is seducing me by playing “Comeback Kid” in a flannel onesie. I wake up hating my life. S 24 Andy Stott – Luxury Problems Andy Stott – Num,1s0et,http://hypem.com/go/itunes_search/Schoolboy%20Q,289,,1,2029066,http://winniecooper.net/2012/12/winnies-top-albums-of-2012/,,3683,Winnie Cooper,https://static.hypem.com/solid_color/83c441,https://static.hypem.com/items_images/da/1s0et_500.jpg,https://static.hypem.com/solid_color/items_images/da/1s0et_120.jpg,219,Druggys Wit Hoes Again (feat. Ab Soul),1363378491
590,Major Lazer feat. Ezra Koenig (Vampire Weekend),1366300859,"Major Lazer has a new LP out this week, Free The Universe. Check out one of the tracks below featuring Vampire Weekend’s Ezra Koenig",1v478,http://hypem.com/go/itunes_search/Major%20Lazer%20feat.%20Ezra%20Koenig%20(Vampire%20Weekend),1270,,4,2154653,http://indymusic.wordpress.com/2013/04/18/jessica-major-lazer-ft-ezra-koenig-from-vampire-weekend/,True,10915,Music From Go to Whoa,http://static.hypem.net/solid_color/thumbs_new/9d/2154653.jpg,http://static.hypem.net/thumbs_new/9d/2154653_320.jpg,http://static.hypem.net/solid_color/thumbs_new/9d/2154653_120.jpg,257,Jessica,1363280864
591,Freqnik & WDRE,1363264974,"Fans of 90s hip hop, Freqnik & WDRE decided to flip the Pete Rock & CL Smooth classic “Ghettos Of The Mind” on their new remix. The old skool hip hop acapella sounds great over the xylophone-filled soul beat. read more at survivingthegoldenage.com",1v3yx,http://hypem.com/go/itunes_search/Freqnik%20&%20WDRE,34,,5,2117201,http://survivingthegoldenage.com/pete-rock-cl-smooth-ghettos-of-the-mind-freqnik-wdre-remix/,,1056,surviving the golden age,http://static.hypem.net/solid_color/thumbs_new/51/2117201.jpg,https://static.hypem.com/items_images/dd/1v3yx_640.jpg,https://static.hypem.com/solid_color/items_images/dd/1v3yx_120.jpg,294,Ghettos Of The Mind Remix,1363276094
592,The Hood Internet,1370311029,"Hey folks, MuMaMe got added to Hype Machine, and I’m so stoked!!! With that said, I apologize, as this isn’t a regular post. Hype Machine only indexed songs starting from post #18, and in order to get previously posted music indexed as well, I’m dropping ",1v3ws,http://hypem.com/go/itunes_search/The%20Hood%20Internet,5251,,17,2200939,http://mumame.com/2013/06/03/31-excavation-free-downloads/,,19826,Music Makes Me...,http://static.hypem.net/solid_color/thumbs_new/15/2182165.jpg,http://static.hypem.net/thumbs_new/32/2167602_320.jpg,http://static.hypem.net/solid_color/thumbs_new/15/2182165_120.jpg,192,Suit And Commercial (Justin Timberlake vs Daft Punk),1363273027
593,Two Door Cinema Club,1362058535,"Another day, another remix of Two Door Cinema Club‘s latest single “Sun.” This time the remix comes courtesy of Viceroy. Viceroy gives the track a super fun 80s-tinged remix. read more at survivingthegoldenage.com",1tr9g,http://hypem.com/go/itunes_search/Two%20Door%20Cinema%20Club,2183,,13,2101746,http://survivingthegoldenage.com/two-door-cinema-club-sun-viceroy-remix/,True,1056,surviving the golden age,http://static.hypem.net/solid_color/thumbs_new/f2/2101746.jpg,http://static.hypem.net/thumbs_new/cb/2118859_640.jpg,http://static.hypem.net/solid_color/thumbs_new/f2/2101746_120.jpg,244,Sun (Viceroy Remix),1362080590
